author,content,description,publishedAt,source.name,title,url,urlToImage
eric stephen,this has been a nightmare season for the georgia bulldogs with just one conference win in tom creans first year at the school they found a creatively excruciating way to add to the misery on wednesday losing in the last second to mississippi state in the m 1328 chars,georgia fell to 112 in the sec with a crushing loss on a lastsecond technical foul after a fan threw a stuffed animal on to the court the ensuing free throw gave georgia a onepoint loss to mississippi state,2019-02-21 02:13:31,sbnation,georgia lost a game because a fan threw a stuffed animal on the court  sb nation,https://www.sbnation.com/college-basketball/2019/2/20/18234132/georgia-mississippi-state-technical-foul-fan-stuffed-animal-wtf,https://cdn.vox-cdn.com/thumbor/LNQw83OhXNvi3XCVoB08aSqeAQU=/0x0:1678x879/fit-in/1200x630/cdn.vox-cdn.com/uploads/chorus_asset/file/14075789/Screen_Shot_2019_02_20_at_5.49.33_PM.png
joel sherman,tampa one day you are gary sanchez and aaron judge you are miguel andujar and gleyber torres you are today and tomorrow and snap somehow it happens so quick that you are trying not to be yesterday greg bird came late in the 2015 season and with one preco 4262 chars,tampa  one day you are gary sanchez and aaron judge you are miguel andujar and gleyber torres you are today and tomorrow and snap somehow it happens so quick that you are trying not to be yest,2019-02-21 01:42:00,nypost,bird voit have something to prove in yankees firstbase battle  new york post ,https://nypost.com/2019/02/20/bird-voit-have-something-to-prove-in-yankees-first-base-battle/,https://thenypost.files.wordpress.com/2019/02/bird.voit_-1.jpg?quality=90&strip=all&w=1200
michael russo,new york charlie coyles days with the wild are over and now hes heading home minnesota on wednesday agreed to trade the massachusettsborn winger to the boston bruins sources said in a deal believed to be for ryan donato and a fifthround pick sources s 661 chars,minnesota on wednesday agreed to trade the massachusettsborn winger to the boston bruins sources say,2019-02-21 01:28:09,theathletic,sources wild trading charlie coyle home to bruins likely  the athletic,https://theathletic.com/829398/2019/02/20/charlie-coyle-wild-trade-bruins-ryan-donato-paul-fenton/,https://cdn.theathletic.com/app/uploads/2019/02/20171827/fullsizeoutput_28da-1024x683.jpeg
nicoleyang,celtics point guard kyrie irving is not a fan of the reaction to a video of him and golden state warriors forward kevin durant chatting in a hallway of the spectrum center during allstar weekend its a video of me and one of my best friends talking irving t 2384 chars,if this was the real world would it be anybody elses business,2019-02-21 01:13:54,boston,kyrie irving sounds off about the reaction to his conversation with kevin durant over allstar weekend  bostoncom,https://www.boston.com/sports/boston-celtics/2019/02/20/kyrie-irving-kevin-durant-free-agency,https://www.boston.com/wp-content/uploads/2019/02/download-8-7-850x478.jpeg
jeff todd,if the white sox are indeed out on bryce harper they are making a huge mistake why did they waste their time sending a delegation to woo him at his las vegas residence earlier this offseason at the more recent soxfest in late january i never once heard ri 3172 chars,if youve been away from the internet for the last 24 hours youll want to catch up on the major hellip,2019-02-21 01:00:00,mlbtraderumors,bryce harper rumors white sox out giants still in  mlb trade rumors,https://www.mlbtraderumors.com/2019/02/bryce-harper-rumors-white-sox-out-giants-still-in.html,https://cdn.mlbtraderumors.com/files/2019/01/USATSI_11029047-1024x810.jpg
racer staff,the future of formula 1 in austin texas appears to have taken a serious hit when it was revealed circuit of the americas lost its state funding according to a wednesday story in the austin americanstatesman newspaper gov greg abbotts office rejected cot 2679 chars,the future of formula 1 in austin texas appears to have taken a serious hit when it was revealed circuit of the americas lost its state funding according to a wednesday story in the austin americ,2019-02-21 00:36:08,racer,cota denied 20 million in state funding for 2018 f1 race  racer,https://racer.com/2019/02/20/cota-denied-20-million-in-state-funding-for-2018-f1-race/,https://racerdigital.files.wordpress.com/2019/02/ham.jpg?w=1000&h=576&crop=1
stefan bondy,more so than any other franchise the knicks have been discussed and dissected as a free agent destination for the better part of a decade no transcendent star has signed at least not yet but that hasnt ceased the yearround speculation and coverage of ne 5673 chars,cj mccollum and damian lillard chime in on the great knicks debate,2019-02-21 00:25:00,nydailynews,neverending knicks free agency debate rages on why arent they going there  new york daily news,https://www.nydailynews.com/sports/basketball/knicks/ny-sports-knicks-freeagency-lillard-mccollum-20190220-story.html,https://www.nydailynews.com/resizer/rrBnOEpH0f0ZfJlTXfX4ur2PP3s=/1200x0/www.trbimg.com/img-5c6df120/turbine/ny-sports-knicks-freeagency-lillard-mccollum-20190220
david malsher,,arrow schmidt peterson motorsportshonda driver marcus ericsson makes his indycar race debut at st petersburg in under three weeks he talked to david malsher about his preparations and the prime differences in driving demands between indycar and formula 1,2019-02-21 00:09:25,motorsport,ericsson confident for 2019 compares indycar with f1  motorsportcom,https://www.motorsport.com/indycar/news/ericsson-indycar-comparison-formula-one/4341469/,https://cdn-2.motorsport.com/images/amp/YMdRgnK2/s6/marcus-ericsson-arrow-schmidt-.jpg
maddie lee,the thunder has officially signed free agent markieff morris the team announced wednesday the power forward was waived by the pelicans after being traded to new orleans by washington on feb 7 the move allowed morris to sign with a playoff contender morri 752 chars,the thunder has officially signed free agent markieff morris the team announced wednesday,2019-02-21 00:08:00,newsok,thunder officially signs markieff morris  newsokcom,https://newsok.com/article/5623551/thunder-signs-markieff-morris,https://cdn2.newsok.biz/cache/r960_blur-2cfa6c6f15689740fe8fa6ac59ad543c.jpg
fletcher keel,by fletcher keel  wctv eyewitness sports february 20 2019 jacksonville fla wctv  florida state baseballs midweek game against jacksonville university has been postponed fsu and ju were scheduled to play on tuesday but weather in the jacksonville a 241 chars,florida state baseballs midweek game against jacksonville university has been postponed,2019-02-21 00:05:41,wctvtv,florida state game at jacksonville postponed  wctv,https://www.wctv.tv/content/news/Florida-State-game-at-Jacksonville-postponed-506127151.html,https://media.graytvinc.com/images/FSU+Maine+2019+baseball.jpg
lewis mckeever,francis ngannou wants a title shot against daniel cormier but the predator has no intention of asking ufc president dana white for any favours according to ngannou he hasnt spoken to white in over a year i havent talked to dana white since one year ago m 1492 chars,ufc heavyweight francis ngannou says he hasnt spoke to dana white in over a year,2019-02-21 00:00:00,bloodyelbow,francis ngannou on relationship with dana white i havent talked to him in over a year  bloody elbow,https://www.bloodyelbow.com/2019/2/20/18233166/ufc-espn-1-mma-news-interview-heavyweight-francis-ngannou-president-dana-white-fight-relationship,https://cdn.vox-cdn.com/thumbor/0Te6pW00oA6fguUsxbQBNbPxgok=/0x532:2000x1579/fit-in/1200x630/cdn.vox-cdn.com/uploads/chorus_asset/file/13617782/1064773036.jpg.jpg
,el segundo calif  with a 2829 record the los angeles lakers are three games out of the playoff picture with 25 regularseason contests left even more daunting they have the fourthtoughest remaining schedule in the nba according to espn stats amp i 5633 chars,lebron james said he is raring to step up his intensity level for a playoff push starting against the rockets on thursday saying the lakers are working our tails off to get there,2019-02-20 23:17:12,espn,lebron james primed to step up intensity for playoff push  its been activated  espn,http://www.espn.com/nba/story/_/id/26040994/lebron-james-primed-step-intensity-playoff-push-activated,https://a3.espncdn.com/combiner/i?img=%2Fphoto%2F2019%2F0218%2Fr503195_1296x729_16%2D9.jpg
,ralph vacchiano  facebook  twitter  archive landon collins is frustrated the giants seem to have no intention of giving him the lucrative longterm contract hes seeking according to an nfl source and he remains unhappy that he is likely to get the fr 4412 chars,landon collins is frustrated the giants seem to have no intention of giving him the lucrative longterm contract hes seeking according to an nfl source and he remains unhappy that he is likely to get the franchise tag instead,2019-02-20 23:12:46,wwwsnytv,source frustrated giants s landon collins thought he was going to get a contract  snytv,https://www.sny.tv/giants/news/source-frustrated-giants-s-landon-collins-thought-he-was-going-to-get-a-contract/304224236,http://content.sny.tv/assets/images/9/6/6/304224966/cuts/750x422/cut.jpg
mike florio,the hall of fame imposes a fiveyear waiting period before players and coaches can be considered for enshrinement when patriots coach bill belichick and quarterback tom brady retire the hall of fame should waive that requirement presumably both will retir 1208 chars,the hall of fame imposes a fiveyear waiting period before players and coaches can be considered for enshrinement when patriots coach bill belichick and quarterback tom brady retire the hall of fame should waive that requirement presumably both will retir,2019-02-20 23:00:00,nbcsports,hall of fame should waive waiting period for belichick brady  nbc sports,http://profootballtalk.nbcsports.com/2019/02/20/hall-of-fame-should-waive-waiting-period-for-belichick-brady/,https://nbcprofootballtalk.files.wordpress.com/2019/02/gettyimages-1126554017-e1550703602936.jpg
luis paezpumar,barcelona real madrid liverpool juventus manchester city these are all european soccer teams and more specifically the teams in the champions league round of 16 that seemed most likely teams to take home the doubleeared trophy on june 1 barcelona and  8203 chars,barcelona real madrid liverpool juventus manchester city these are all european soccer teams and more specifically the teams in the champions league round of 16 that seemed most likely teams to take home the doubleeared trophy on june 1 barcelona and ,2019-02-20 22:59:00,deadspin,who the hell is going to win the champions league  deadspin,https://deadspin.com/who-the-hell-is-going-to-win-the-champions-league-1832763455,"https://i.kinja-img.com/gawker-media/image/upload/s--5ezSVD8R--/c_fill,fl_progressive,g_center,h_900,q_80,w_1600/pfscd6jhon8hlnuf2e7b.jpg"
chip towers,athens  georgia and auburn are definitely going to move their annual game to an early fall date starting in the 2020 season and for the foreseeable future and the bulldogs and tennessee also will be switching dates as well that was the word from uga presi 4990 chars,athens  georgia and auburn are definitely going to move their annual game to an early fall date starting in the 2020 season and for the foreseeable future and the,2019-02-20 22:39:22,dawgnation,tennessee and auburn to switch spots in georgia football schedule starting in 2020  dawgnation,https://www.dawgnation.com/football/georgia-football-schedule-2020-auburn-tennessee,"https://res.cloudinary.com/dawgnation/image/upload/c_crop,g_north_west,h_1290,w_2451,x_0,y_151/f_auto,q_auto/h_624,w_1186/v1511982065/Kirby-Smart-Gus-Malzahn-Getty-Michael-Chang_hnxtyj.jpg"
fox news,barack obama slammed pop culture on tuesday for foisting bad values on young men speaking at the mbk rising my brothers keeper alliance summit in oakland calif the former president explained how he felt about currentday culture lets face it a lot 1830 chars,former president barack obama slammed pop culture on tuesday for foisting bad values on young men,2019-02-20 22:30:20,fox news,barack obama slams pop culture for foisting bad values on young men  fox news,https://www.foxnews.com/entertainment/barack-obama-slams-pop-culture-for-foisting-bad-values-on-young-men,https://static.foxnews.com/foxnews.com/content/uploads/2019/02/barack-obama.jpg
httpswwwnewschannel5comaboutuscatlinbogard,nashville tenn wtvf with its major league soccer debut just over a year away nashvilles mls team unveiled their new logo and branding wednesday night at marathon music works the logo can be seen above the event was hosted by renowned espn sportscenter 288 chars,with its major league soccer debut just over a year away nashville unveiled its new logo and branding wednesday night at marathon music works,2019-02-20 22:22:00,newschannel5,nashvilles mls team to be called nashville soccer club unveils new logo  newschannel5com,https://www.newschannel5.com/sports/nashvilles-mls-team-set-to-unveil-logo-branding,https://ewscripps.brightspotcdn.com/dims4/default/2c8e096/2147483647/strip/true/crop/1388x729+0+0/resize/1200x630!/quality/90/?url=https%3A%2F%2Fewscripps.brightspotcdn.com%2F3e%2F23%2Fc1d176804564be673c5047a575d4%2Fscreen-shot-2019-02-20-at-5.33.06%20PM.png
,late goals from leroy sane and raheem sterling gave manchester city a 32 win at schalke 04 in their champions league round of 16 first leg on wednesday that put the english side in the driving seat substitute sane scored against his former club with a sensa 1893 chars,get a report of the schalke 04 vs manchester city 201819 uefa champions league round of 16 football match,2019-02-20 22:21:06,espn,schalke 04 vs manchester city  football match report  february 20 2019  espn,http://www.espn.com/soccer/report?gameId=530638,https://a4.espncdn.com/combiner/i?img=%2Fphoto%2F2019%2F0220%2Fr504462_1296x729_16%2D9.jpg
,tampa fla  forced into a full season of downtime because of ankle and heel injuries troy tulowitzki watched a lot of baseball last year and there was one club that regularly caught his eye i saw a lot of this team tulowitzki said of his current empl 4253 chars,troy tulowitzki who missed all of last season with the blue jays due to injuries says hes healthy and excited about chasing a world series title with the yankees,2019-02-20 21:54:27,espn,troy tulowitzki healthy hoping to help yankees finish 2019 with a championship  espn,http://www.espn.com/mlb/story/_/id/26040353/troy-tulowitzki-healthy-hoping-help-yankees-finish-2019-championship,https://a4.espncdn.com/combiner/i?img=%2Fphoto%2F2019%2F0220%2Fr504458_1296x729_16%2D9.jpg
kerry crowley,click here if you are having a problem viewing the photos on a mobile device scottsdale ariza players ability to mash 60mile per hour fastballs is hardly a predictor of success but when games are still a few days away batting practice home runs are sti 4948 chars,with the first cactus league games approaching the giants have developed a plan for buster poseys spring workload,2019-02-20 21:37:00,mercurynews,san francisco giants early camp standouts catch coaching staffs attention  the mercury news,https://www.mercurynews.com/2019/02/20/san-francisco-giants-spring-training-standouts-buster-posey-aramis-garcia/,https://www.mercurynews.com/wp-content/uploads/2019/02/BNG-L-GIANTS-0221-1.jpg?w=1024&h=683
chip towers,athens  greg mcgarity has been doing a lot of talking lately about the future to date though that has been about the university of georgias future not his but the bulldogs athletic director of the last 10 years had no choice but to have his future add 5716 chars,athens   greg mcgarity has been doing a lot of talking lately about the future to date though that has been about the university of georgias future not his but,2019-02-20 21:30:15,dawgnation,breaking news georgia ad greg mcgarity gets 1year contract extension from athletic board  dawgnation,https://www.dawgnation.com/football/team-news/breaking-news-georgia-ad-greg-mcgaritys-gets-1-year-contract-extension-from-athletic-board,"https://res.cloudinary.com/dawgnation/image/upload/c_crop,g_north_west,h_2885,w_5472,x_0,y_489/f_auto,q_auto/h_624,w_1184/v1550645207/MCGARITY_mlxkoi.jpg"
,miami  point guard goran dragic and forward derrick jones jr are on their way back to the miami heat rotation both practiced wednesday and are available for miamis game at philadelphia on thursday dragic has played in only two of miamis last 41 games  516 chars,miami heat guard goran dragic and forward derrick jones jr are expected to return to the lineup for thursdays game at philadelphia following lengthy injury absences,2019-02-20 21:26:11,espn,goran dragic derrick jones jr set to return to heat rotation  espn,http://www.espn.com/nba/story/_/id/26040151/goran-dragic-derrick-jones-jr-set-return-heat-rotation,https://a2.espncdn.com/combiner/i?img=%2Fphoto%2F2017%2F1108%2Fr286216_1296x729_16%2D9.jpg
,question how important was it for you to get a staff that you are comfortable with and have a history with i do think thats always important coach andy reid was tremendous a bunch of coaches had obviously left here for other jobs where there were openin 1860 chars,spagnuolo spoke with the local media via a conference call on wednesday afternoon,2019-02-20 21:26:05,chiefs,five things we learned from new chiefs dc steve spagnuolo on wednesday  chiefscom,https://www.chiefs.com/news/five-things-we-learned-from-new-chiefs-dc-steve-spagnuolo-on-wednesday,https://static.clubs.nfl.com/image/private/t_editorial_landscape_12_desktop/chiefs/lwtsnlmdh6dqhvqcl3s5
steven marrocco,ufc lightweight dustin poirier has campaigned almost nonstop for a big fight now hes looking for the exit door poirier 30 called for his release wednesday after several months of inactivity and frustration laid bare on social media these guys should ju 2224 chars,has dustin poirier finally reached the end of his rope with the ufc,2019-02-20 21:20:00,mmajunkie,with no offers on table dustin poirier hopes for ufc release  mmajunkie,https://mmajunkie.com/2019/02/ufc-dustin-poirier-asks-to-be-released-frustrated-lightweight-division,https://usatmmajunkie.files.wordpress.com/2018/07/dustin-poirier-jon-anik-ufc-on-fox-30-calgary.jpg?w=1000&h=576&crop=1
,in less than a month landon collins is scheduled to hit free agency where he would garner considerable interest from a number of safetyneedy teams  unless the giants decide to utilize the franchise tag to prevent him from becoming a free agent by the so 2548 chars,the allpro safety is scheduled to hit free agency next month,2019-02-20 21:16:00,cbssports,landon collins on whether he cleaned out his giants locker anything left i do not need  cbs sports,https://www.cbssports.com/nfl/news/landon-collins-on-whether-he-cleaned-out-his-giants-locker-anything-left-i-do-not-need/,https://sportshub.cbsistatic.com/i/r/2019/02/20/ef9af4aa-54d8-4937-b11d-47914be78134/thumbnail/770x433/021f05287d0582ad7849e8b012002550/usatsi-11007846.jpg
,getsimplestringdatatitle getsimplestringdatadescription getsimplestringdatavideocounttext,,2019-02-20 21:15:23,youtube,pelicans reportedly pressing nba to let them sit anthony davis  the jump  espn,https://www.youtube.com/watch?v=4WBHmCwwEIY,
zach kruse,both will be highly coveted around the league and expensive to sign but safety earl thomas and edge rusher trey flowers stand above the rest as the two highestend targets for the green bay packers as free agency approaches if gm brian gutekunst wants to us 2950 chars,no two free agents would do more to help turnaround the packers defense than earl thomas and trey flowers,2019-02-20 20:58:46,usa today,earl thomas trey flowers represent top fa targets for packers  packers wire,https://packerswire.usatoday.com/2019/02/20/earl-thomas-trey-flowers-represent-top-fa-targets-for-packers/,https://usatpackerswire.files.wordpress.com/2019/02/usatsi_11989555-e1550696784809.jpg?w=1024&h=576&crop=1
,cj anderson explains how patriots shut down rams offense in super bowl liii originally appeared on nbcsportsbostoncom the los angeles rams lost super bowl liii in one of the most frustrating ways possible  their very talented highscoring offense manage 1969 chars,what did the patriots do to slow down the rams offense in super bowl liii cj anderson provided some insight tuesday on fox sports 1,2019-02-20 20:48:00,yahoo,cj anderson explains how patriots shut down rams offense in super bowl liii  yahoo sports,https://sports.yahoo.com/c-j-anderson-explains-patriots-204805321.html,https://s.yimg.com/uu/api/res/1.2/1sl325.wbVhK0_H6sTKwSQ--~B/aD0xMzQ2O3c9MjAxOTtzbT0xO2FwcGlkPXl0YWNoeW9u/https://media.zenfs.com/en/csnne.com/2f0c30e65bef8a9cd8b88302db054bbf
travis reier,five questions for alabamas inside linebackers as the crimson tide moves through the offseason 5 would it be wise to discount,five questions for alabamas inside linebackers as the crimson tide moves through the offseason,2019-02-20 20:40:55,247sports,five offseason questions for alabamas inside linebackers  247sports,https://247sports.com/college/alabama/Article/Alabama-Crimson-Tide-football-five-offseason-questions-for-Alabamas-inside-linebackers-in-2019-129305397/,"https://s3media.247sports.com/Uploads/Assets/527/887/8887527.jpg?fit=bounds&crop=1200:630,offset-y0.50&width=1200&height=630"
,from 19992013 tiger woods amassed 18 wins in world golf championships events in nine different locations including seven victories in the tournament now known as the wgcmexico championship subscribe to pga tour now httppgatusvbxczsh welcome to the  910 chars,from 19992013 tiger woods amassed 18 wins in world golf championships events in nine different locations including seven victories in the tournament now k,2019-02-20 20:36:21,youtube,tiger woods alltime shots in world golf championships  pga tour,https://www.youtube.com/watch?v=AFGyY3cW06c,https://i.ytimg.com/vi/AFGyY3cW06c/maxresdefault.jpg
,the news of a joel embiid injury is not what sixers fans wanted coming out of the allstar break while the allstar centers left knee soreness may seem alarming his head coach downplayed it at the teams practice facility wednesday referring to it as tendin 3132 chars,not the postallstar break news sixers fans were hoping for by noah levick,2019-02-20 20:33:37,nbcsports,joel embiid out at least a week  nbcsportscom,https://www.nbcsports.com/philadelphia/76ers/joel-embiid-out-least-one-week-sixers-injury-update,https://www.nbcsports.com/philadelphia/sites/csnphilly/files/2019/02/20/ap_joel_embiid_ben_simmons_sixers.jpg
,the best rivalry in college basketball without question its duke vs north carolina when the blue devils and tar heels meet its not only one of the best matchups of this season but it happens to double as the premier rivalry in the sport  this seaso 2986 chars,what you need to know when the no 1 blue devils play host to the no 8 tar heels on wednesday,2019-02-20 20:24:00,cbssports,duke vs north carolina prediction pick odds line tv channel watch online live stream preview  cbs sports,https://www.cbssports.com/college-basketball/news/duke-vs-unc-prediction-pick-odds-line-tv-channel-watch-online-live-stream-preview/,https://sportshub.cbsistatic.com/i/r/2017/03/06/e4e07c09-1262-4526-ba33-e08211cf11aa/thumbnail/770x433/d6d9507d71e3436cb6b97178a306c24d/usatsi-9922569.jpg
david mackay,it must be tiresome to shoulder the scoring burden of an injuryplagued team put up 40 points a night and be widely criticized for playing the wrong way that has been the life of houston rockets guard james harden for the better part of two months now hav 2663 chars,having led his team to a 2110 record through 31 consecutive games of scoring at least 30 points harden has become the subject of disapproval from his peers,2019-02-20 20:19:22,usa today,windhorst james harden sensitive about criticism from peers  rockets wire,https://rocketswire.usatoday.com/2019/02/20/houston-rockets-james-harden-sensitive-to-criticism/,https://usattherocketswire.files.wordpress.com/2018/12/GettyImages-1074477678.jpg?w=1024&h=576&crop=1
jeff proctor,lansing mich wilx  the michigan department of licensing and regulatory affairs has filed administrative complaints against two michigan state university athletic trainers investigators say destiny treachnorhauk and lianna hadden lied when they claim n 2626 chars,state investigators say destiny treachnorhauk and lianna hadden lied when they claimed no students had ever brought up nassars abuse to them,2019-02-20 19:58:09,wilx,state file complaints against two msu athletic trainers in the nassar investigation  wilxtv,https://www.wilx.com/content/news/States-file-complaints-against-two-MSU-athletic-trainers-in-the-Nassar-investigation-506112301.html,https://media.graytvinc.com/images/destiny+treachnor+hauk+lianna+hadden.jpg
chris mccosky,last slide next slide the tigers reportedly have agreed to a oneyear deal with second baseman josh harrison photo11 jeff roberson associated press lakeland fla  when shortstop jordy mercer first showed up at tigertown after signing a oneyear 525  4930 chars,harrison 31 spent eight seasons in pittsburgh where he was a twotime allstar 2014 2017,2019-02-20 19:53:00,detroitnews,report tigers sign second baseman josh harrison seeking first base help too  the detroit news,https://www.detroitnews.com/story/sports/mlb/tigers/2019/02/20/detroit-tigers-may-not-done-adding-roster/2926010002/,"https://www.gannett-cdn.com/presto/2019/02/20/PDTN/79650042-b423-471b-9730-654b19937093-harrison.jpg?crop=1457,820,x0,y506&width=3200&height=1680&fit=bounds"
